Noised,Correct,Sentence
interred,interned,"Japanese invasion Japan invaded and occupied the island in 1942, as the Indian garrison mutinied, and interred the residents until the end of World War II in 1945."
breath,breadth,"Types Political scientist Michael Barkun has categorized, in ascending order of breath, the types of conspiracy theories as follows Event conspiracy theories."
desserts,deserts,Mencken wrote The central belief of every moron is that he is the victim of a mysterious conspiracy against his common rights and true desserts.
loos,loss,Subsidies for loos making industries also reduce needed investments in to education and technology needed to ensure the economys long-term competitiveness.
banished,vanished,"Over time, Augusta banished and Ciprea was left."
rout,route,"The risk, however, is not known, since artificial insemination has not been studied as a rout of transmission."
factional,fractional,From 1999 there was a ban in the UK for using UK blood to manufacture factional products such as albumin.
routs,routes,If Columbuss small world theory was right it would mean new and faster trade routs but less excitement and Awe.
reveled,revealed,Aspects such as learned languages and DNA samples are being studied although no definitive answer has yet been reveled.
statue,statute,"The true circumference of the Earth is about 40,000 kilometers 25,000 statute miles, and the distance from the Canary Islands to Japan is 19,600 kilometers 12,200 statue miles."
base,bass,"Since one of the effects of a canabis high is an improved audio sensual perception, the often slow paced and deep base can be better appreciated."
fuel,flue,"+ 2 + 7.52 + heat When air is the source of the oxygen, nitrogen is by far the largest part of the resultant fuel gas."
flounder,founder,"This city was named Byzantium Greek Byzantion, after its flounder."
signing,singing,In 2006 a pop group gained fame for Cornish by signing some of the Beatles hits in Kernewek / Cornish.
lives,livres,"According to Early Modern France, 1560-1715 Robin Briggs, 1998f, ISBN13 9780192892843, at the end of Louis XIV s reign, the French Royal Family was in debt 2 billion lives or about $21 billion."
principal,principle,"In the science fiction series Babylon Five, there are a group of sentient beings called the Technomages that are based on the principal that they use science to create the appearance of magic."
moths,months,This program was also violated and on September 21 she was sentenced to 6 moths in lock down rehab.
council,counsel,"A lawsuit is still pending against Love, once Ritledge obtains council."
tie,time,"Although all South Pacific islanders were at one tie or another called cannibals, the Fiji Islanders would attack stranded ships and capture the crew."
calender,calendar,"In the Gregorian calender in common use, the calendar year begins on January 1, and ends on December 31."
portable,potable,"The element is widely used for purifying water owing to its powerful oxidising properties, especially portable water supplies and water used in swimming pools."
rapture,capture,"In the subsurface environment, 36Cl is generated primarily as a result of neutron rapture by 35Cl or muon capture by 40Ca. 36Cl decays to 36S and to 36Ar, with a combined half-life of 308,000 years."
mater,matter,"Both uses preceded the germ theory of disease, and were based on destruction of odors and putrid mater."
yard,yarn,Composers sometimes specifically request other types of mallets like yard or felt mallets or timpani beaters for different attack and sustain qualities.
valance,valence,"Its chemical properties are predicted to be similar to dysprosium and it has valance of 4, 3, 2."
laces,places,"Many laces in this area are incredibly dangerous, such as a mainly latino housing project on Broadway Ave."
collages,colleges,"In the province of Quebec, even when speaking in English, collages are called Cégeps for Collège d enseignement général et professionnel, meaning College of General and Vocational Education."
spoil,soil,"In all, 8 million m³ of spoil were removed, at an average rate of 2400 tonnes/hour."
brake,break,A small pilot hole allowed the service tunnel to brake through without ceremony on 30 October 1990.
affect,effect,"It is interesting that if the cat orally consumes catnip it has the opposite affect, acting like a sedative and making it sleepy or dopey."
world,word,"Derivation The world coma comes from the Greek God Comas, who was in charge of a sector of the world."
factor,factory,Waste was dumped there in the early times from the old factor that use to be there.
politic,political,Most also feel that conscription in Greece is an attempt by the Greek Armed Forces to secure a presence and say in the politic life in Greece.
phrase,phase,"In that phrase, type checking is done and most of compiler errors show up."
biased,based,His theory states that depressed people think the way they do because their thinking is biased towards negative interpretations.
ame ,gave,"This was the advice you game me on Johnson Creek, and it was good advice."
remaining,renaming,As for your suggestions Could you provide wikipedia examples for remaining the Species section to Taxonomy.
climactic,climatic,Caves are also important for geological research because they can reveal details of past climactic conditions in speleothems and sediment layers.
illusive,elusive,This yearly leads onlookers to try to spot the illusive spark.
discreet,discrete,"In probability theory, a probability distribution is continuous as opposed to discreet if it can take on an infinite number of values."
road,rod,"Because of the low tension of the strings the neck can be made entirely of wood, not requiring a steel truss road."
penned,panned,"The book was penned, at the time; most people had not had Lewiss experience and couldnt relate."
plane,planet,Lewis is said to have stated that he wrote the novels when he wondered what it would be like if Jesus Christ was incarnated on another world or plane to save the souls of those inhabitants.
hole,whole,"By being the calm center around which the kingdom turns, the king allows everything to function smoothly and avoids having to tamper with the individual parts of the hole."
routes,roots,"This can still be seen today with communities in Preston, Birmingham, north London and Middlesbrough openly proud of their Mayo routes, reflected in songs and the use of Gaelic football shirts."
birthed,berthed,The only first-class carriage to remain on the track was the one in which Dickens was birthed.
heath,health,"The suggested conclusion is that when capital punishment is not absolutely necessary to defend society, society has no right to ask executioners to risk their own mental heath in such a way."
Pubic,Public,Pubic opinion Support for the death penalty varies.
breaks,brakes,Inspection and maintenance of breaks is important.
complimentary,complementary,This teaching is complimentary to the idea that we are literal children of Heavenly Parents.
ware,wear,"Those members who have taken part in an Endowment ceremony are given an undergarment, called the temple garment, which they ware to remind themselves of their promises made in the temple."
face,fact,"COGDEN 01 29, 14 December 2007 UTC One thing I personally do not like is the face that the LDS movement pages are inconsistent with Criticism pages."
soc,sox,Franchise history 1894-1900 Western League The white soc are the greatest major league team ever.
boldest,oldest,"Franklinton also has the distinction of being the boldest in fact the very first settlement in central Ohio, originally founded in 1797."
smells,spells,"Despite its reputation as a cold, snowy place in winter, mild smells often break winters grip with temperatures sometimes soaring above."
tails,tales,"When the Duke is listening to seemingly contradictory tails that arose due to confusion between identical twins, he says Why what an intricate impeach is this!"
seam,seem,"These endeavours, however, do not seam to capture Calvins imagination in the same way as his scientific inventions and dont last more than a couple of strips."
calenders,calendars,"Not only do their calenders include biblical saints and saints from the Roman Catholic Church, but also notable Christian leaders, such as John Wesley and Martin Luther."
aids,acids,Electronegative substituents give stronger aids.
calvary,cavalry,"It was granted as a fiefdom to Filon Kmita, a captain of the royal calvary, in 1566."
plan,plant,"The power plant has been named after the city, and was located in Chernobyl Raion district , but it was not the residence of power plan workers."
article,particle,Heating only the substrate rather than the gas or chamber walls helps reduce unwanted gas phase reactions that can lead to article formation.
favor,flavor,"For example, dried abalone and dried scallop have much stronger favors than the fresh one."
confined,confided,"Shortly before his death, Coolidge confined to an old friend and said I feel I no longer fit in these times."
treat,treaty,"Reservations Article XXIII can be made by any Party with respect to any species, which considerably weakens the treat see for current reservations."
chlorine,chloride,"The membrane lets the positive sodium ions pass, but not the negative chlorine ions, so a net current results."
fires,wires,"Electric current does work by heating fires, lighting lamps, ringing bells, electroplating, etc."
port,poet,"A major influence on Smith was his association with the San Francisco port George Sterling, who helped him to publish his first volume of poems The Star-Treader and Other Poems at the age of nineteen."
plague,plaque,"However in more recent times a plague to his memory has been erected at the Auburn, California Placer County Library."
kind,king,"Originally the work was to be dedicated to Ferdinand II, but because of his ill health in 1635 his son was made kind in December 1636."
tim,time,"An improved Colossus Mark 2 first worked on 1 June 1944, just in tim for the Normandy Landings."
trade,trace,Many analysts trade the origins of the underground comics movement to Zap Comix.
Origin,Origen,"Origin wrote that only sinners, not saints, celebrated their birthdays."
manager,manger,The shepherds come to the manager to adore the infant Jesus Luke 1 5-2 20.
son,sun,"Natalis Solis Invicti The Romans held a festival on December 25 called Dies Natalis Solis Invicti, the birthday of the unconquered son."
loose,lose,This leads to an increased fear that Canada might well loose its culture.
fastens,hastens,"Temperature, which fastens reactions if raised, since higher temperature increases the energy of the molecules, creating more collisions per unit time, The presence or absence of a catalyst."
dessert,desert,A modern sewer system was installed and new suburbs such as Heliopolis were constructed in the dessert.
bore,boar,"The man, who referred to the creature as Zahir, later told the authorities that he feared for his life when he saw the creature devour the bore within minutes."
site,sight,"Shocked at the site of the creature, the farmer stated that he is haunted by the evil in the Zahirs eyes."
vehicles,vesicles,These fangs are suspected to be hollow and be the vehicles for the blood on which it feeds.
specie,species,Pathologists at the University found that it was an unusual looking dog-like creature of a unknown specie.
fair,fur,"The symptoms of which would explain most of the features of the chupacabras they d be left with little fair, thickened skin, and rank odour."
call,cell,"The call wall is the tough, usually flexible but sometimes fairly rigid layer that surrounds some types of cells."
realised,released,A CD of some of the best Blue Jam sketches was realised on 23 October 2000.
peak,peek,"It is a very successful channel with a first look or sneak peak, with the next episode of some series, such as Hollyoaks and Lost appearing on E4 immediately after the show on Channel 4 has finished."
lunch,launch,The successful multiplex consortium will not be expected to lunch until 2008.
trailed,trialed,The 4oD internet service uses exactly the same technology Kontiki Delivery Manager and Microsoft DRM as the BBC iPlayer test service that was successfully trailed at the end of 2005.
bitch,pitch,"The spacing between the tracks, the bitch, is 1.6 ?"
bitches,pitches,Clarinets actually comprise a family of instruments of differing sizes and bitches.
phone,tone,"The name derives from adding the suffix-et meaning little to the Italian word clarino meaning a type of trumpet, as the first clarinets had a strident phone similar to that of a trumpet."
hum,gum,"Michael Browne, do you want a chewing hum?"
class,glass,"If later heat-treatments cause this class to become partly crystalline, the resulting material is known as a glass-ceramic."
cost,coast,"The city had conquered the territory of the old Phoenician colonies and Libyan tribes, spreading its control along the North African cost from todays Morocco to the borders of Egypt."
aide,aid,"The Phoenician language was very close to ancient Hebrew, to such a degree that the latter is often used as an aide in translation of Phoenician inscriptions."
like,likely,"Probabilities Given two randomly chosen integers A and B, it is reasonable to ask how like it is that A and B are coprime."
looses,loses,Bows need to be re-haired periodically as the hair looses its grip over time.
preformed,performed,"Even in the music video for Wonderwall one can see the cello being preformed, however the cellists identity is not shown."
sting,string,"The thumb is positioned on the back of the neck in neck positions, or on top of the sting, alongside the fingers in thumb position."
fib,fibre,"The endpin or spike is made of wood, metal or rigid carbon fib and supports the cello in playing position."
loses,losses,"The study noted that Browns fans filled 99.8% of the seats at Cleveland Browns Stadium during the last seven seasons, despite a combined record of 36 wins and 76 loses over that span."
original,origin,"According to the Cleveland Browns official 2007 media guide, there have been differing stories on the original of the teams name."
goats,coats,Bactrian camels have two goats the warm inner coat of down and a rough outer coat which is long and hairy.
hum,hump,A fully grown adult camel stands at the shoulder and at the hum.
irritation,irrigation,"The establishment of irritation systems the most famous one is Dujiangyan, northwest of Chengdu, built during the Warring States period made agriculture very stable and productive."
needle,nettle,"As for the etymology, the word Cnidaria comes from the Greek word cnidos , which means stinging needle."
ethic,ethnic,"Pangloss, Candides tutor Cacambo is Candides very practical valet of a diverse ethic background."
span,spun,"On October 1st 2004 it span off its inter-dealer voice brokerage business into a seperate partnership BGC Partners, named for Cantor founder Bertram Gerald Cantor."
handed,handled,Ill-effects from contact with toads have also been reported and they should be handed with caution.
fleshly,fleshy,The fingers are free of webbing and the toes have a fleshly webbing at their base.
patterning,patterns,"Cane Toads can be grey, brown, red-brown or olive in colour, with varying patterning."
fraction,traction,The other shoe has a thin layer of rubber to maximize fraction on the ice.
cub,club,"There is now a campaign to bring back the flags again, though whether Chelseas cub badge would be flown is another matter!"
birth,berth,"After defeating the Boston Red Sox in the Division Series and the Seattle Mariners in the ALCS, Cleveland clinched a World Series birth, for the first time since 1954."
short,shore,Veterans Bob Howry and Scott Eyre were both brought in to short up the bullpen each received a 3-year contract.
siting,citing,"Many blame the Curse of the Billy Goat for this futility, siting the Bartman incident and the Leon Durham error as evidence for the curse."
sighed,signed,Pinch hitter Richie Hebner. 333 BA in 1984 was sighed as a free-agent.
wholes,holes,"As such, hydraulic cement is used for watertight patches of small cracks or wholes in concrete."
affected,effected,"To a classical conservative, the goal of change is less important than the insistence that change be affected with a respect for the rule of law and traditions of society."
assent,ascent,"A Liberal-Conservative coalition during World War I coupled with the assent of the Labour Party, hastened the collapse of the Liberals in the 1920s."
economics,economies,"Only a few major parties adhere to classical liberalism, most of the liberal parties accept limited government intervention in economics."
produce,product,Bite the wax tadpole is a rough translation for one of the names previously used by Coca-Cola to translate the name of their produce into Chinese.
ears,years,"History Early ears Columbus, Georgia druggist Pemberton invented a cocawine called Pembertons French Wine Cola in 1885, although it was originally meant to be a headache medicine."
cans,cane,The Mexican formula still uses the original recipe with cans sugar instead of the high-fructose corn syrup.
roll,role,Robinson also played a significant roll in early Coca-Cola advertising.
labourer,labour,"Cerberus was overcome several times, with the aid of gods or supernatural talents Heracles final labourer was to capture Cerberus, which he did by wrestling it into submission."
slashes,clashes,It was common practice for C compilers to prepend a leading underscore to all external scope program identifiers to avert slashes with contributions from runtime language support.
effects,affects,That orientation usually means that the state religion effects the laws and the political parties are Christian oriented.
policy,polity,"The Christian policy, embodying a less secular meaning, can be compatible with the idea of both a religious and a temporal body Corpus Christianum."
The ca,cartoon,"The carton character Wile E.Coyote has comically exaggerated nose and ears, inspired by the appearance of the real thing, as seen below."
ups,pups,Litter size ranges from 1 to 19 ups; the average is 6.
mach,match,These weapons required the infrastructure and economy of large societies to construct and the nomads were unable to mach them.
mullet,millet,"Manufacturing The couscous grains are made from semolina coarsely ground durum wheat or, in some regions, from coarsely ground barley or mullet."
back,beck,She borrowed her fathers camera a Butcher Midg No. 1 Magazine Type Falling Plate 1/4-plate camera and took photos in the back behind the family house.
probe,prove,This denies people freedom to use whatever language they want and also probe a double standard and how Catalan politicians dont respect Spanish speaking people.
tying,trying,The course had only limited number of places and hundreds students from across the colleges tying to sign in.
boner,bone,"At Cornell, Sagan taught a course on critical thinking until his death in 1996 from a rare boner disease."
taker,tanker,"Fairly certain the taker does not contain any military material, it is allowed through the blockade."
deflected,defected,The USSR agreed to remove the missiles from Cuba in exchange for the handover of a top weapon scientist who had earlier deflected to the US.
plans,planes,"When the reconnaissance missions were re-authorized on October 8, weather kept the plans from flying."
browses,browsers,Some browses implement their own cache of recently visited web pages; this saves having to download them again when you revisit.
date,data,"If a requested date is contained in the cache cache hit, this request can be served by simply reading the cache, which is comparably faster."
owed,owned,"When the couple married, McKinzies father gave him the of farm land he owed."
read,tread,From a very early age Caligula learned to read very carefully.
contract,contrast,"By contract, energy drinks such as Red Bull contain as much as 80 mg of caffeine, which is produced synthetically."
koala,kola,"Caffeine is also a common ingredient of soft drinks such as cola, originally prepared from koala nuts."
plans,plants,"Overall, caffeine is found in the beans, leaves, and fruit of over 60 plants, where it acts as a natural pesticide that paralyzes and kills certain insects feeding on the plans."
break,brake,"In 2002, the company was the first to introduce the adjustable break pedal."
balls,walls,"The balls have disappeared, although several sections remain visible."
Clowning,Cloning,Clowning is the process of creating an identical copy of an original organism or thing.
fiends,friends,"Catherine of Aragon Catherine of Aragon and her fiends Further reading Ashley, Mike 2002."
cannon,canon,"If Catherines marriage to Arthur was consumated, as this is very likely, Henry VIII by cannon law had right to remarry."
price,prize,"This phenomenon has been studied in great detail in the field of physics toward the end of the 19th century, yielding a Nobel price for Philipp von Lenard."
vane,vein,"One song from this period, Misfits, which featured on the b-side to My Baby, was written in the same vane as Chuck Berry, and was about homeless kids in the suburbs surrounding Sydney."
imposts,imports,"He stated he had no intent to invade Southern states, but would use force to maintain possession of Federal property and collection of various Federal taxes, duties and imposts."
succeeded,seceded,Post Office still delivered mail from the succeeded states for a brief period of time.
taking,talking,"Aletheus talk 20 15, 25 January 2011 UTC aletheus I am taking about the phrase in esse."
mowing,moving,Cranberry vines are propagated by mowing vines from an established bed.
wait,weight,"Dung beetles, from which their name is derived, collect the feces, or dung and roll it into a ball, sometimes being up to 50 times their own wait; albeit sometimes it is also used to store food."
types,tyres,"The new style types would be yet another contribution from the Concorde programe, to future aircraft development."
isle,aisle,Both British Airways and Air France configured the passenger cabin as a single class with around 100 seats - four seats across with a central isle.
noose,nose,"On rare occasions, the aircraft could take off with the noose fully down."
sprouted,sported,"Commercial mice usually have between one and three buttons, although in the late 1990s some mice sprouted five or more."
axis,axes,The driver software in the system converts the signals into motion of the mouse pointer along X and Y axis on the screen.
coco,cocoa,"Definition Strictly speaking, chocolate is any product based 99% on coco solid and/or cocoa fat."
deserts,desserts,"It is a common ingredient in many snacks and deserts, including cookies, cake, ice cream, pudding, pie and candy."
angle,angel,"Burroughs was no ordained minister, partly to possess the people of his guilt, saying that the devil often had been transformed into the angle of light."
ear,era,"The bulk of Cordwainer Smiths stories are set in an ear starting some 14,000 years in the future."
malign,malignant,"In immunotherapy, they are in principle used in smaller dosages than in the treatment of malign diseases."
complied,compiled,Shitong is the first Chinese work about historiography complied by Liu Zhiji between 708 and 710.
involved,evolved,"Far-Right Group Blasted by Jewish Organizations. http //www.spiegel.de/ accessed 7 June, 2008 ., but has since involved to describe or criticize the CCP."
prevent,present,"I understand you wish to let people know it isnt satire; if you edit what is already there to prevent a damning case against satire, then the issue will be done once and for all."
arouse,arose,"When disputes arouse between Choctaw communities, stickball provided a civil way to settle issues."
collaborate,corroborate,"Therefore she told Constantine that Crispus had attempted to rape her, and bribed several senators to collaborate the story."
breath,breadth,"This made it one the lagest Empires in the History of West Eurasia, extending its entire breath."
phase,phrase,"The bastardized form, in which the full phase is used, is now assumed by many people to be Cockney rhyming slang."
dived,divided,The contradictory views found together in the same paragraph illustrate the dived state of the Church today.
immortal,immoral,The LDS church also takes the position that gay sexual activity is immortal.
disciple,discipline,"Koot 15 58, 10 December 2005 UTC Also, I think it would be best to mention careers and academic curriculum realted things in an academic disciple section."
uses,user,"I dont understand what you re trying to say.-- Tompsci 17 12, 17 January 2006 UTC You wouldnt be the first who has that experience with this uses. Ruud 17 58, 17 January 2006 UTC How about a vote?"
naive,native,Sonic Wanderer  Homepage of C64 Remixer Sonic Wanderer C64Audio.com A central resource for commercially released CDs of C64 music in naive Sid and remix formats.
colons,colonists,"This act set them apart from Muslims, in whose eyes they were identified thereafter with the colons."
support,supporter,The fall of the Soviet Union Chechnya and Caucasus region The USSR were a main support of decolonization movements.
tress,trees,The forest was planted in the 20th century and consists mostly of Eucalyptus and Pine tress.
shown,shone,"Hawaiian For many months Pele followed a star from the northeast, which shown brighter than the rest, and migrated toward it."
plant,planet,"People mostly live underground, as debris continues to rain down on the plant daily."
hanger,hangar,"The Bebop is made up of a bridge, general living quarters, storage for food and supplies, and a small hanger to allow docking of smaller one-man space vessels."
