Noised,Correct,Sentence
lieben,blieben,"Nur das preußische Finanzministerium, die Archivverwaltung und wenige andere Landesbehörden lieben bis 1945 eigenständig."
war,wahr,Diese so genannten Oberschwingungen nimmt man als einen einzelnen Klang war.
entscheiden,entschieden,Variante a lehnt er entscheiden ab „Recht durch Frieden ist sinnvoll und anständig; Friede durch Recht ist imperialistischer Herrschaftsanspruch“.
äußern,äußeren,"Zwischen dem Aufdruck und der Aluminiumschicht Dicke der Reflexionsschicht 50-100 nm befindet sich noch eine Schutzschicht, die dazu da ist um das Aluminium vor äußern Einflüssen zu schützen."
stärke,starke,"Auch die Tallage ist südlich der Elbe wesentlich flacher, was die stärke Entwicklung dort begünstigte."
viel,fiel,Das Land viel damit in eine tiefe Krise.
bestimmen,bestimmten,Regelwerk Wie jede Meisterschaft unterliegt auch die Fußball-WM bestimmen Regeln.
überlegen,überleben,"Ja, aber du wirst eingestehen, dass es täglich weniger werden und in absehbarer Zeit nur noch einige Global Player mit ihren kleinen Zulieferern überlegen werden."
start,stark,"Hermann Muller begann einige Zeit später, mit Röntgenstrahlen zu experimentieren und konnte zeigen, dass die Bestrahlung von Fliegen deren Mutationsrate start erhöht."
keinem,keimen,Oft keinem sie allerdings schon nach ein paar Monaten.
zugegen,zugegeben,Unter starkem Rühren werden nun einige Tropfen Olivenöl zugegen.
unbenannt,umbenannt,Das von ihr und der polnischen Regierung 1932 gegründete Radium-Institut wurde 1951 nach ihr unbenannt.
einige,eigene,Neuseeland hat aber auch eine einige Filmindustrie Bekannt ist beispielsweise der Science-Fiction-Film Quiet Earth.
lieben,lieber,"Er kommt, nimmt eine Frau, und unvermögend ihren Hochmut zu ertragen, kehrt er lieben in die Hölle zurück, als sich wieder mit ihr zu vereinigen."
lasen,lassen,"In der Atomphysik werden Alkalimetalle häufig eingesetzt, da sie sich aufgrund ihrer besonders einfachen elektronischen Struktur besonders einfach mit Lasern kühlen lasen."
After,Alter,Im After von sechs Jahren wurde Turing nach St.Michaels in eine Ganztagsschule geschickt.
Rezessionen,Rezensionen,Der Film erhielt überwiegend positive Rezessionen und Jolie erntete besonderes Lob. 
Krampf,Kampf,Während seiner Haftzeit schrieb Hitler mit Hilfe seines Sekretärs Rudolf Hess den ersten Teil seines Buches Mein Krampf.
Falten,Fakten,"Hier wird sinnentstellend und auf unterstem intellektuellen Niveau eine Scheiße zurechtgeschrieben, die mit den Falten wenig bis gar nichts zu tun hat."
Potenz,Latenz,Leistung von Speichermodulen (Schaltzeitverhalten / Timing) Die Leistung von Speichermodulen misst sich vor allem in der absoluten Potenz.
bekannten,bemannten,Für den bekannten Mondflug wurde die bis heute größte Rakete entwickelt.
Wegen,Wagen,"Im Römischen Reich wurden um 200 n. Wagen benutzt, die durch die Muskelkraft von Sklaven im Inneren der Wegen bewegt wurden."
riecht,reicht,"So riecht die agrare Produktion nicht aus, um den eigenen Bedarf zu decken und das Land ist auf den Import von Lebensmitteln angewiesen."
westlich,wesentlich,"Viele HFA-Autisten sind deshalb als Erwachsene nicht von Asperger-Autisten zu unterscheiden, meistens bleiben jedoch die autistischen Symptome westlich deutlicher ausgeprägt als beim Asperger-Syndrom."
Abstimmung,Abstammung,"Benoît B. Mandelbrot (* 20. November 1924 in Warschau) ist ein französischer Mathematiker polnischer Herkunft, jüdisch-litauischer Abstimmung, mit US-Amerikanischer Staatsangehörigkeit."
Vorgang,Vorhang,"Sie fand ihre ""Fortsetzung"" in der Grenzbefestigung zwischen der Bundesrepublik Deutschland und der DDR und in dem Eisernen Vorgang zwischen Ost und West in Europa."
Abschlägen,Anschlägen,In die Schlagzeilen der Medien Westeuropas gelangt das Baskenland vorwiegend im Zusammenhang mit Abschlägen der ETA.
Konfessionen,Konzessionen,Aber auch hier wurden schon z.T. Konfessionen an das moderne Leben gemacht.
Stiel,Stil,Diese Idee wollten die Beiden im grösseren Stiel weiterführen.
Flut,Flucht,Durch den britischen Beschuss mit Granaten gelang nur 116 Matrosen die Flut vom sinkenden Schiff.
erlassen,entlassen,Die Bundesminister werden auf Vorschlag des Bundeskanzlers vom Bundespräsidenten ernannt oder erlassen.
sag,sah,"Ende August sag sich die Regierung daher gezwungen, eine Ausgangssperre zu verhängen."
Verbrennung,Verbreitung,"Verbrennung Die Brennnesseln, auch rotes Feuer genannt, sind nahezu weltweit verbreitet, sie sind nicht besonders anspruchsvoll, sie fehlen nur in Permafrost gebieten."
Standart,Standard,"Es existiert jedoch kein Standart der Bildung, stattdessen ist Mannigfaltigkeit der Bildungsformen notwendig: jeder ist eben auf seine eigene Art und Weise gebildet."
Zeile,Ziele,Nutzen Die Zeile beim Einsatz eines Caches sind eine Verringerung der Zugriffszeit bzw. eine Verringerung der Anzahl der Zugriffe auf den zu cachenden Speicher.
Brei,Blei,"Eigenschaften Calcium ist weicher als Brei, lässt sich aber mit einem Messer nicht schneiden."
spielen,spülen,Nach Augenkontakt : Mit Augendusche oder unter fließendem Wasser 10 bis 0 Minuten bei gut geöffnetem Lidspalt spielen. 
wird,wirkt,Biologische Bedeutung Elementares Chlor wird oxidierend und kann mit pflanzlichem und tierischem Gewebe reagieren. 
Orgasmus,Organismus,"Gelangt ein solcher Kampfstoff auf die Haut, diffundiert er durch sie hindurch in die Blutbahn und wird so schnell im ganzen Orgasmus verteilt."
siegt,stieg,"Das Bruttosozialprodukt siegt im Jahr 2004 um 6,1% auf 94 Milliarden US-Dollar, dies entspricht in etwa 6225 US-Dollar je Einwohner."
begannen,begangen,"Gabriela Mistral (1889–1957), Dichterin und Nobelpreisträgerin 1945, schrieb in ihren Gedichten über Liebe, Tod und Hoffnung, nachdem ihr Geliebter Romelio Ureta Selbstmord begannen hatte."
Internet,Internat,"Für Lewis war dies ein großer Verlust, da er sich stark an sie geschlossen hatte, nachdem sein Bruder die meiste Zeit im Internet verbrachte."
erden,werden,"Einige Quellen vermuten, dass der Name Tremonia mit „Dreimauernstadt“ übersetzt erden könne."
zweigt,zeigt,"Der im Jahr 1998 beschriebene Fund stammt von dem kleinen, sehr jungen Coelurosaurier Scipionyx und zweigt Abdrücke verschiedener Darmabschnitte, der Leber, der Muskeln und der Luftröhre. "
Wiese,Weise,Kritische Sicherheitslücken werden auf diese Wiese häufig innerhalb von Stunden geschlossen.
Ecke,Erde,"Duergar Die Duergar, auch Dunkelzwerge oder Grauzwerge genannt, sind eine böse Abart der Zwergenrasse, die sich tief unter der Ecke verstecken und die das Sonnenlicht verabscheuen."
erschossen,erschaffen,Er hat mit seiner berühmten „Göttlichen Komödie“ die italienische Literatursprache aus dem bis dahin dominierenden Latein förmlich „erschossen“.
Mark,Markt,"Vorrangig in den USA brachten Kamerahersteller wie Canon, Nikon, Konica oder Fuji Weiterentwicklungen dieses Modells auf den Mark. "
verführen,verfügen,"So gibt es den Nährstand der Handwerker und Bauern, die auch in diesem Staat über Eigentum verführen."
regiert,reagiert,In den unteren heißen Zonen regiert aber auch der Kohlenstoff direkt mit dem Eisenerz.
Stele,Stelle,"Sie setzten die Arbeit an der Stele fort, wo Rejewskis aufhören musste und erreichten u.a. das Dechiffrieren des 1939 verbesserten Enigma-Version."
Gesetzte,Gesetze,"Um den Bedürfnissen der muslimischen Bevölkerung gerecht zu werden, gibt es außerdem noch eine kleine Anzahl von Gerichten, die die Gesetzte der Schari'a durchsetzen."
Gräber,Gräben,"Furchen und Gräber Europas auffälligstes Merkmal ist ein Netzwerk von kreuz und quer verlaufenden Gräben und Furchen, Linea genannt, die die gesamte Oberfläche überziehen."
Wurm,Turm,"Der Wurm wurde in der Zeit vom 28.Januar 1887 bis zum 31. März 1889 von Gustave Eiffels Firma, der Gustave Eiffel & Cie, für die Weltausstellung anlässlich des hundertjährigen Jubiläums der französischen Revolution erbaut. "
verlosen,verloren,Trotz der Fokussierung auf diesen Kontinent sollte jedoch die Lage in Nordamerika nicht völlig aus den Augen verlosen werden.
Urin,Uran,Dieses ist ein wichtiges Zwischenprodukt in der Urin gewinnung für Kernkraftwerke. 
Beiladung,Beladung,"Der Flughafen hat zwar auch den Besuch einer Boeing 747 SP der Fluggesellschaft PanAm im September 1976 erlebt, jedoch ohne wesentliche Beiladung und Betankung."
Gesicht,Gedicht,Nach dem Gesicht Hyndluljóð reitet sie auch auf dem Eber Hilisvini.
Annahme,Ausnahme,Auch die Existenz der Regionalpartei CSU (anstelle eines Landesverbandes der CDU) begründet keine Annahme in Bezug auf den Föderalismus.
Hand,Hang,"Am Hand des Schlossberges verläuft die Sporgasse, eine vor allen bei Touristen beliebte Einkaufs- und Cafestraße.. "
entschlossen,erschlossen,Die höher gelegenen Teile Gibraltars sind dagegen touristisch nicht entschlossen.
ausdrucken,ausdrücken,"Der Mensch „inkorporiert“ demnach seine soziale Umwelt durch geistige Lernakte, die sich auch körperlich ausdrucken."
Überwinterung,Überwindung,"Der Anbau von großsamigen Sorten gewährleistet im kühlen, relativ trockenen Hochland eine rasche Wurzelentwicklung und somit die Überwinterung von unerwarteten, kurzen Trockenperioden. Trockenperioden, die länger als zwei Wochen dauern, können die Bohnen in den Tropen, insbesondere während der Blüte schlecht vertragen und es kommt zu Ertragsreduktionen. "
Bänder,Länder,Siehe auch: Liste der Konsulate und Handelsvertretungen in Hamburg Länderfusion Im Gespräch ist immer wieder eine Fusion mehrerer norddeutscher Bänder.
Makeup,Markup,Die Hypertext Makeup Language (HTML) ist ein Dokumentenformat zur Auszeichnung von Hypertext im World Wide Web und wurde 1989 von Tim Berners-Lee am CERN in Genf festgelegt.
geboten,gebogen,Die Augen sind haselnussfarben. Höckerschwäne tragen ihren Hals häufig S-förmig geboten.
Anhänge,Anfänge,Diese Auffassung wird folgendermaßen begründet: Die Anhänge werden Konfuzius zugeschrieben.
Länder,Lager,Zwischen 1916 und 1918 veröffentlichte das IKRK mehrere Ansichtskarten mit Motiven der von seinen Delegierten besuchten Länder.
Bericht,Bereich,Neben dem Beratungszweig finden hauptsächlich in diesem Bericht die zahlreichen Dienstangebote ihr Zuhause.
Liege,Wiege,"Der Irak liegt auf dem Gebiet des alten Mesopotamien; hier sind ab dem 2. Jahrtausend n. Chr. einige der frühesten Hochkulturen der Menschheit entstanden (Sumer, Babylon, Assyrien), weshalb die Region heute von vielen als Liege der Zivilisation gesehen wird. "
Jaguar,Januar,"Der Jaguar (v. lat. ianua „Tür, Zugang“) ist der erste Monat des Jahr es im Gregorianischen Kalender."
Betrag,Beitrag,Für seinen Betrag zur Einigung Europas wurde er am 10.Januar 1958 mit der Ehrendoktorwürde der Katholischen Universität Löwen ausgezeichnet.
Nachtisch,Nachttisch,"Insgesamt rezensierte Tucholsky mehr als 500 Bücher, wobei er in seinen seitenlangen Rubriken ""Auf dem Nachtisch"" oft ein halbes Dutzend Bücher auf einmal besprach."
Zeichen,Zeichnen,Schon Goethe lernte dort Zeichen.
blond,blind,Er bekam in den folgenden Jahren immer stärkere Probleme mit seinem Augenlicht und war ab 1740 halbseitig blond. 
Schlupf,Schlüpfen,Am häufigsten suchen die Larven allerdings die Stängel oder Blätter von Ufer- oder Wasserpflanzen beziehungsweise Schilf zum Schlupf auf.
Erfolge,Erbfolge,"Um auch die Thronfolge zu sichern, beabsichtigen die beiden die Adoption eines entfernte englischen Lords, der dann die Erfolge antreten soll."
Station,Stadion,Unbreakable: Hier spielt er den vermeintlichen Drogendealer der im Station gestellt wird.
regieren,reagieren,Mit Luft und Wasser regieren sie sehr heftig.
Piraten,Primaten,Der moderne Mensch (Homo sapiens) ist ein Säugetier aus der Ordnung der Piraten (Primates).
Städte,Stätte,"Das nördlich des Alten Hafens, zu Fuße desselben gelegene Quartier du Panier, von den Einheimischen knapp „Panier“ genannte im 2. Arrondissement gelegene Viertel, ist das alte antike Marseille und die Städte der ersten Besiedelung. "
hauen,bauen,"Man entschloss sich, die bestehende Linie zu sanieren sowie weitere neu zu hauen."
Kücken,Kühen,Im Handel in der EU darf als „Milch“ nur Milch von Kücken bezeichnet werden.
verheilt,verhielt,"Der Versuchsleiter verheilt sich neutral, selbst seine Kleidung war in einem unauffälligen Grauton gehalten. "
romantischen,romanischen,"Diese Bezeichnung wird u.a. im englischen und französischen Sprachraum verwendet, Ableitungen hiervon in den romantischen und zum Teil auch in slawischen Sprachen. "
Satz,Sitz,Der provisorische irakische Regierungsrat erhält einen Satz in der Arabischen Liga; seit dem Sturz der Regierung von Saddam Hussein war der irakische Sitz dort vakant.
notiert,dotiert,Der Wirtschaftspreis ist immer genauso hoch notiert.
gelingen,gelangen,"Um unbemerkt in die Stadt gelingen zu können, bestach er einen Torwächter, damit dieser das Tor nicht abschloss."
Opfer,Oper,Entstehung der Opfer: Die Oper im heutigen Sinn entstand Ende des 16.Jahrhunderts in Florenz.
erzieht,erzielt,"Wie das Ergebnis erzieht wird (etwa Öffnen von Dateien, Positionieren eines Zeigers, etc.), ist im Gegensatz zu 3GL-Sprachen nicht mehr zu beschreiben."
Flame,Flamme,Bein Schmelzen des Metalls mit z.B. Propan -Sauerstoff muß deshalb mit neutral bis schwachoxidierender Flame gearbeitet werden.
Email,Emaille,Praseodymverbindungen werden zum Färben von Glas und Email verwendet.
geeinigt,geeignet,Als Windschutz sind Pappeln wegen ihres raschen Wuchses gut geeinigt.
direkter,diskreter,Sie haben unterschiedliche Größen und Eigenschaften und werden zum Berechnen und Speichern direkter Zahlenwerte benutzt.
Grand,Grad,Der dritte Stand (Bauern und Handwerker) ist durch ein hohen Grand an Begehren und damit Begierden charakterisiert.
eingeschlossen,eingeflossen,Lehren Platons und seiner Schule sind über die Kirchenväter (s. Patristik) in das christliche Glaubens- und Gedankengut eingeschlossen.
Teer,Tier,"Der Begriff Panzootie beinhaltet zusätzlich das griechische {{lang|el|ζώον}} (Transliteration zóon ) für „Teer""."
lieben,blieben,"Nur das preußische Finanzministerium, die Archivverwaltung und wenige andere Landesbehörden lieben bis 1945 eigenständig."
Verse,Ferse,"Es gelingt ihm jedoch, den griechischen Helden Achilleus zu töten, der bis auf seine Verse als unverwundbar gilt"
fördern,fordern,"Nach Meinung von Experten würde eine Massenimpfung der deutschen Bevölkerung mehr Opfer fördern als eine früh erkannte Pockeninfektion, die dann konsequent und unter Quarantäne behandelt werden würde."
Kopf,Knopf,"In dieser Szene wird die Farbe wenige Sekunden zu früh zugeschaltet, da der rote Kopf lediglich eine Attrappe war."
unbenannte,unbemannte,"Die Anstrengungen konzentrierten sich nun verstärkt auf die unbenannte Raumfahrt, auf die kommerzielle Nutzung des Orbits, sowie auf die permanente Etablierung der Menschheit im Orbit."
Tulpe,Tupel,"Dinge, die in der Relation R'' zueinander stehen, bilden ein ''n Tulpe, das Element von R ist."
Leere,Lehre,"Kritiker sehen in Traugott Giesen einen Showmaster oder Schaumschläger, der sich nach ihrem Geschmack zu weit von der christlichen Leere entfernt hat."
erfasst,verfasst,"Der Corriere di Informazione Sammarinese und der Resto del Carlino werden zwar in Italien erfasst, enthalten aber Informationsseiten über San Marino."
Herr,Heer,"Objektiv gesehen, war es Germanicus durch sein Handeln indes gelungen, das Herr zu disziplinieren."
Tassen,Tasten,"Die Tassen sind ""flach eingebettet""."
spielt,spiegelt,"Kronos wird dann seinerseits von Zeus abgelöst, der als weniger archaisch erscheint und eine Zeit spielt, in der Menschopfer aufgehört hatten."
sing,sind,"Auch Tiere explodieren oder verkochen nicht, wenn sie dem Vakuum kurzzeitig ausgesetzt sing."
Sole,Sohle,Herzog kochte seine Schuhe und aß einen bis auf die Sole auf.
Kapital,Kapitol,Das Kapital steht auf dem Schnittpunkt der vier Distriktgrenzen.
sieg,stieg,Der Gewinn sieg dabei um mehr als 5 % auf 13.4 Mrd.US-Dollar.
Tümpel,Tempel,"Aus dieser anfänglich kurzen Reiseliste entstand zeitweise ein ganzer Reisekatalog, der alle bedeutenden Bauwerke, wie Tümpel oder Skulpturen enthielt. "
Dozent,Dutzend,Die Teilnehmeranzahl in Seminaren ist gemäß der verfügbaren Zeit auf ein gutes Dozent begrenzt.
Baurat,Bauart,Geschlossener Umlaufwindkanal Abb. Geschlossener Umlaufwindkanal englischer Baurat für den subsonischen Geschwindigkeitsbereich. 
abgeschlossen,abgeschossen,Der letzte wildlebende Vogel wurde am 24. März 1900 abgeschlossen.
Tonen,Tonnen,"Dem Turm kommt eine ganz entscheidende Rolle zu, da auf ihm die sehr schwere Maschinengondel (bis zu mehreren hundert Tonen schwer) befestigt wird."
Sekret,Dekret,"Im Deutschen Reich erließ Kaiser Wilhelm II. ein Sekret, welches den Beginn des neuen Jahrhunderts auf den 1.Januar 1900 legte."
springen,sprengen,"In Duke Nukem 3D muss man im Level „Darkside“ einen Monolithen springen, dazu erklingt die Musik des Films."
Roxette,Rosette,"Als Geburtsstunde der modernen Ägyptologie gilt das Jahr 1822, als es Jean-François Champollion gelang, die ägyptischen Hieroglyphen zu entziffern (Stein von Roxette)."
Miene,Mine,"Katastrophen 19. Januar: Südlich von Athen läuft der Griechische Dampfer ""Himara"" auf eine Miene."
troupe,troop,"The International Thespian Society, a society comparable to a fraternity yet possessing the troupe system of the Girl Scouts for students involved in the arts has also been named in his honor."
lying,flying,The major change has been the recent boom in consumer lying.
son,sun,"He fell asleep and Helios, the son, walked in on the couple."
roll,role,He plays the roll as a Wolverine and a Thor both having the traits of killing and the muscle of Thor.
soldiers,shoulders,"He had a prepossessing body, broad soldiers, he had a goaty and long hair."
manor,manner,Others have been able to adapt the concept of a Higher Power in a manor that works for them.
tenants,tenets,"The 12 Steps conspicuous lack of any reference to refraining from drinking, but numerous references to God Most of the steps being re-packaged religious tenants that came straight from Dr.Bobs and Bill W.s own earlier association with the Oxford Groups The Language of the Heart, William G."
affect,effect,Its goal is to affect enough change in the alcoholics thinking to bring about recovery from alcoholism.
felling,feeling,"Struck that Thacher was a hopeless alcoholic like himself, and felling that they shared a kinship of common suffering, Wilson and continued to meet with him."
conductive,conducive,"Twelve-step groups, like AA, are not conductive to probability sampling of members."
ttendants.,attendance,"Every third year since 1968, AA has issued a pamphlet summarizing its latest triennial survey of meeting attendants."
s d art,objets,"That year, Rodin offered his first sculpture for exhibition, and entered the studio of Albert-Ernest Carrier-Belleuse, a successful mass producer of objects d art."
capital,capitol,"The town set aside 40 acres 162,000 m^2; of undeveloped land and offered it to the State of Michigan as the site of the state capital, but it lost the bid to Lansing in 1836."
net,next,"There season would end the net week in Philadelphia as the Eagles won, 20-6."
complete,compete,This development effort was made partly to allow IBM to complete with Amdahl UTS.
principals,principles,An understanding of astrological principals is needed to fully appreciate such literature.
winds,wins,The Diamondbacks in the regular season posted the best record in the NL with 90 winds and 72 losses.
excepted,accepted,"Therefore, due to impossibility for precision, there is much confusion about what interpretations should be so officially excepted."
tables,tablets,Moses is made to say that he constructed the Ark before going upon Mount Sinai to receive the second set of tables.
sort,sought,"The Atlanta years By the early 1960s attendance in Milwaukee had dwindled as well, and a new group of owners once again sort relocation."
loosing,losing,"Meanwhile, Tramiel discovered that Warner Communications wanted to sell Atari, which at that point was loosing about $1 million a day."
paste,pace,"She was able to sing very high, very low, and sing at a normal paste."
place,plane,"The NTSB reported that the total gross weight of the place was substantially exceeded, which caused the center of gravity to be pushed too far aft."
layed,laid,"The entrance to Ferncliff Cemetery, where Aaliyah is layed to rest, location of where she is buried."
collage,college,"The book also emphasises that the war was worst for the lost generation, those who went straight from school or collage into the trenches, as the narrator had done."
metal,medal,"After John Brown failed and was hanged, Hugo and DeLaboulaye took up a collection among the French people and presented a gold metal to John Browns widow."
impassible,impassable,"The island was larger than Libya and Asia Minor combined, but has since been sunk by an earthquake and became an impassible mud shoal, inhibiting travel to any part of the ocean."
calender,calendar,"The Egyptians used a lunar calender based on months, and the Greeks a solar one based on years."
perpetrating,perpetuating,Popular culture often places Atlantis there; perpetrating the original Platonic setting.
kay,key,"Therefore, anybody owning an arabian horse could possibly hold the kay within to unlock the passage to the lost city of Atlantis."
flows,floes,Its furry paws allow it to walk on ice flows in search of food.
load,loan,"Modern Armenian has numerous load words from the Old Persian Language Pahlavi, which still exist in Modern Persian."
expand,expend,"A battleship could possibly expand a hundred large caliber shells on a warship and score possibly a dozen hits, and usually no more than thirty miles maximum range."
diary,dairy,"It is here that red-meat-based foods are combined with white meat, diary products and pasta, producing a high-protein diet."
capital,capita,"Historically, Argentine annual consumption of beef averaged 100 kg 220 lbs per capital, National Geographic Magazine."
bear,beer,"Mention has already been made of the carob tree, whose bark is used to make artisan foods and drinks a type of bread called patay and a type of bear called aloja."
handhold,handheld,"In 1989, Atari also released the Atari Lynx, a handhold console with color graphics, to critical acclaim."
filled,filed,"Ajax also had a satellite club in the United States under the name Ajax America, this club filled for bankruptcy."
investing,inverting,"The forms of cords corresponded to the lines of tension of the prim structure and when investing the photo, the lines of pressure of the compressed structure were obtained."
pot,top,"Anatomy and function Anatomically, the adrenal glands are located in the thoracic abdomen situated at the pot of the kidneys, specifically on their anterosuperior aspect."
layers,lawyers,People who attend the undergraduate school prefer Harvard College just as the layers say they went to Harvard Law School.
college,colleagues,"Despite what the chairman had told Miller, the committee asked him to reveal to them names of friends and colleges who partaken in similar activities."
achieving,archiving,This makes them suitable file formats for storing and achieving an original recording.
boast,boost,Therfore the overall speed boast is \frac 1 .4575 2.186 or a little more than double the original speed using the formula \frac 1 \frac P1 S1 + \frac P2 S2 + \frac P3 S3 + \frac P4 S4.
anime,amine,"""An alkaloid, strictly speaking, is a naturally-occurring anime produced by a plant, but amines produced by animals and fungi are also called alkaloids."
feet,feat,"Alkaloid classifications Alkaloids are usually classified by their common molecular feet, based on the metabolic pathway used to construct the molecule."
calvary,cavalry,Combining these genes with an array of genes for other domains of the antibody generates a large calvary of antibodies with a high degree of variability.
raped,ramped,"The Ford era Ford placed Aston in the Premier Automotive Group, substantially invested in new manufacturing and quickly raped up production."
route,rout,By this time Dostum was commanding a militia battalion to fight and route rebel forces.
hanger,hangar,The narrow-body repair hanger will be shut down.
dugs,drugs,"Recent research suggests that antidepressants act on transcription factors termed clock genes, which also are involved in actions of dugs of abuse and possibly in obesity."
god,dog,"Hopkins is known to be a joker while on set, lightening the mood during production by barking like a god before filming a scene, according to a Tonight Show interview broadcast on 9 April 2007."
plains,plans,"The moves to develop the port for more tourism have been welcomed by the city and its residents, but the latest plains to develop an industrial estate in the port have caused great controversy."
call,cell,"The decision for apoptosis can come from the cell itself, from its surrounding tissue or from a call that is part of the immune system."
principal,principle,Both the courts opinion and Justice O Connors concurrence were careful to avoid supporting the principal that the right to marry would be subject to the same analysis.
table,tablet,In 1937 it became available in table form.
psychical,physical,"Most students use it only during final examinations, but some use it on a much more regular basis, which can lead to psychological and psychical addiction."
imate it,imitate,"The Amphetameanies, a ska-punk band, are also named after amphetamine, but also intimate its effects."
ordinance,ordnance,Projectiles The projectile is the ordinance or bullet fired downrange.
seized,ceased,"Following the abdication of Nicholas II, Alexandra seized to be the Empress of all the Russias."
