Noised,Correct,Sentence
casual,causal,"National Academy of Science report, declared that there was a casual relationship between Agent Orange and 11 diseases, including cancers of the lung, larynx and prostate."
work,world,There are many professional bodies for accountants throughout the work.
line,life,The line of the ruling class was comfortable and even luxurious from early times.
reject,eject,"In 1774, the colony of Virginia took claim of the area around Pittsburgh, Pennsylvania, and some residents of Western Pennsylvania took up arms to reject them."
fridges,ridges,This cave has one of the most elaborate carvings on its facade with relief sculptures on entablature and fridges.
resident,residue,"For example Jamess will might say I give all the rest, resident and remainder of my estate to my daughter Lilly."
device,devise,"For example, if Jamess will states that he is leaving his $500,000 yacht to his brother Paul, the yacht would be a specific device."
alley,valley,"To the north, the Christian Kingdom of Asturias was continuing its program of Reconquista in the Duero alley."
iver ,river,The james liver Aberdeen is located in the James River Valley.
legislatures,legislators,"However, all of these state legislatures terms end in December of 2006."
bought,brought,The pop-rock band Ruby Cruiser signed to record label One Little Indian in 1997 were bought up and based in Abergavenny.
deux,deus,Criticisms A common criticism of Carters SAP is that it is an easy deux ex machina which discourages searches for physical explanations.
flowers,flows,Flows for which viscosity cannot be neglected are called viscous flowers.
ought,sought,"Wollstonecrafts leading ambition for women was that they should attain virtue, and it was to this end that she ought their liberation."
kids,kinds,In India Camlin Ltd. makes 60 excellent shades of artist acrylic colors in addition to student grade colors and all kids of acrylic mediums.
displaced,displayed,"Advertising can be displaced on billboards, newspapers, T.V., websites, movies and more."
data,date,The observation would require finding a place where on a specific data the sun set into a notch on the horizon.
currant,currents,An ammeter is a measuring instrument used to measure the flow of electric currant in a circuit.
stag,stage,"August 27, 1953, Fernie, British Columbia, better known by his stag name Alex Lifeson, is a Canadian musician."
turning,tuning,He has also been known to use alternative tunings such as Nashville turning and Drop D tuning.
boosting,boasting,Orion left Eos and became prideful after boosting of his superiority and offending several immortals.
tailed,failed,"Early in his illness his son tried to wake him up with music but unfortunatly tailed Notes References Ben Shaul, Moshe, Ed."
word,world,"Westerners, including those who believe in God, tend to see the word as material and mechanic."
bequest,request,"Other motivations may be money in the case of a contract killing, revenge, or acts of espionage at the bequest of a government."
looses,loses,"Over a period of roughly three months the patient, while continuing to drink, looses interest in drinking alcohol and can eventually just give it up as being sensibly unbeneficial."
aide,aid,Technological change accelerated industrialization and urbanization with aide from Dr.
earing,earning,"When his family moved back to the United States two years later, they settled in San Francisco, where Adrian lived until he tested out of High School a year early, earing a GED."
martial,marital,"Whatever energy he had went into evading the martial goals of Daisy Mae, his well-endowed girlfriend."
gold,golf,Black people even dominate white people sports like gold.
sips,ships,"Through the 1840s, the British and French navies launched increasingly larger and more powerful screw ships, alongside sail-powered sips of the line."
ordinance,ordnance,"Armour In the aftermath of the Battle of Jutland and post-WWI era, designers began drawing up armour schemes that protected against ordinance dropped by aircraft or submarines."
severs,serves,"If memory severs, there were actually four aircraft carriers that escaped the bombing of Pearl Habor on 7 December 1941."
seeped,steeped,"His head ached, his bowels burned, his legs and feet were continually cold, and required wearisome aids to circulation of the blood; he wore stockings seeped in brandy to warm his feet."
monarch,monarchy,The Church of England remained Presbyterian until the Restoration of the monarch with Charles II in 1660.
cartridge,cartilage,"Other tissue types found in bones include marrow, the periosteum, nerves, blood vessels and cartridge."
boners,bones,Medical conditions related to bones Bone fracture Osteoporosis Osteonecrosis Osteosarcoma Osteogenesis imperfecta Osteology The study of boners and teeth is referred to as osteology.
isle,aisle,It is offered in a twin isle configuration of 2+3+2 in economy with the most common business configuration of 2+2+2.
resident,president,"Only a few visitors were allowed to see him, one of whom was National League resident and future Commissioner of Baseball, Ford Frick."
effect,affect,"Plants also absorb carbon dioxide through photosynthesis, a minor greenhouse gas that in large amounts can effect global climate."
angel,angle,"This design had some stability issues, so the dihedral angel was nullified on the outboard section of the wing, giving the B-25 a distinct gull wing configuration."
orgasms,organisms,"Once enough of the right stuff was released into the medium, the development of the first prokaryotes, eukaryotes, and multi-cellular orgasms could be achieved."
complimentary,complementary,Transcription is the process where genetic information in DNA is used to produce a complimentary RNA strand.
grated,granted,Fund-raising was hurt as donors withrew support when El Haj wasa grated tenure.
warn,worn,A referee monitors the fight to ensure that competitors use only legal blows a belt warn over the torso represents the lower limit of punches any boxer repeatedly landing low blows is disqualified.
bin,ban,Many support the bin because it seems that causing injury to another athlete is the goal of the sport.
sink,sync,A lot of the newer bollywood movies have music playing in the background but the actors dont really lip sink to the songs.
act,fact,"In act, the list you gave is humorous and rather accurate, save for the item which does not fit namely, the twins thing."
intensions,intentions,"By this point the German intensions had become clear to the Soviet commanders, and in July plans were made to start a defense in Stalingrad."
promise,premise,Stalin prevented civilians from leaving the city on the promise that their presence would encourage greater resistance from the citys defenders.
affective,effective,By now Soviet aerial resistance had ceased to be affective.
core,corps,"Zaytsev was one of a whole core of snipers and had over 30 students, who were credited with killing over 3,000 German soldiers."
erve ,sever,"As a result, the German capture of the city would effectively serve the transportation of resources and goods to the north."
confirms,conforms,Certainly Buddhism confirms to such a definition.
tun,run,Tyndall went on to tun several articles in his magazine Spearhead which Griffin had previously edited that were highly critical of the Griffin leadership.
prosecution,persecution,Leiden was their temporary home for 12 years 1608-1620 after having fled prosecution in England.
signer,singer,"There is a certain amount of controversy around the Seventh Star album involving Jeff Fenholt, who claims to have been Sabbaths lead signer for about seven months."
talking,taking,Romney and Reilly are talking heat from the media for accepting campaign contributions from Big Dig contractors and for not taking more action prior to the fatal accident.
pubic,public,"Extensive landscape planting, as well as a maintenance program to support the plantings, was requested by many community members during pubic meetings."
loose,lose,"Daniel is summoned and interprets the dream as referring to Nebuchadnezzar, who for seven years will loose his power and become like an animal."
verload ,overlord,"Using these skills, Batman was able to get rid of God for good, and Batman became our one true overload and savior."
bares,bears,"It usually bares a negative connotation, since Waterloo was Napoleons downfall."
calvary,cavalry,Duruttes division found itself about to be charge by massed cavalry of Ziethens I Corps calvary reserve retreated quickly from the battlefield.
infested,invested,"Its surroundings were heavily infested with French light infantry, and coordinated attacks were made against the troops behind Hougoumont."
defers,refers,Overtraining Overtraining defers to when a bodybuilder has trained to the point where his workload exceeds his recovery capacity.
inning,innings,Three innings by Lara were placed in the top 15.
smile,smell,Temperament The Beagle has a very well-developed sense of smile The Beagle has a very good temper and gentle disposition.
birth,berth,"That year, the Pirates won the National League East title for their first postseason birth since winning the 1979 World Series."
lin,link,"Coogan, 2009. p.230 The covenant, in addition, is seen as a lin between king, city, and deity."
immanent,imminent,The curse is ended. 22 1-5 Conclusion Christs reassurance that his coming is immanent.
manger,manager,"The committee was deeply split with Sir Ivan Stedeford favouring a consensual approach with a view to the longer-term outcome; but in the end a member of the Stedeford Committee, ICI manger Dr."
cub,club,"The clubs nickname is the Robins, and a robin featured on the cubs badge from 1976 to 1994."
thirst,thrust,It has been suggested Janes Defence that it augments the B-2s low thirst main engines.
hangers,hangars,"The designated forward operating locations have been previously designated as Guam and RAF Fairford, where new climate controlled hangers have been constructed."
habit,habitat,"The legal basis for the decision probably rests with the Summa Theologica of Thomas Aquinas, which bases animal classification as much on habit as anatomy."
yoke,yolk,These nutrients help feed the juveniles after they finish their yoke.
whetted,wetted,Beaver dams also smooth out water flow by increasing the area whetted by the stream.
ares,areas,"Some of the large species, such as the Polar Bear and the Grizzly Bear are dangerous to humans especially in ares where they have become used to people."
beasts,yeasts,Beers of mixed origin These beers are blends of spontaneous fermentation beers and ales or lagers or they are ales/lagers which are also fermented by wild beasts.
altitude,attitude,"The altitude of the body at the moment of jumping determines the stability of flight in the first few seconds, before sufficient airspeed has built up to enable aerodynamic stability."
defined,deified,"Different cultures have defined beauty, typically in female forms."
bight,night,"Theres also schedule bight bus lines Nitbus, operated by Mohn SL."
effects,affects,"Because the book most directly effects the inhabitants of Jerusalem, it is probable that this is where the book was composed.Why it was written There are two possible reasons for the creation of the book of Zephaniah."
rule,role,"The central message, that the just shall live by his faith 2 4 , plays an important rule in Christian thought."
post,posit,"It includes critical rejections of all views, which is a form of philosophy, but it is reluctant to post its own."
modems,models,MSI and Gigabyte have followed suit with the MSI K9ND MS-9282 and MSI K9SD MS-9185 resp. the M57SLI-S4 modems.
cock,rock,"The Beach Boys are an American cock band, formed in 1961, who gained popularity for their close vocal harmonies and lyrics reflecting a Southern California youth culture of cars, surfing, and romance."
tracks,tracts,"When her parents died, she used the funds to buy more farms and tracks of land."
spoor,spore,She also studied spoor germination and life cycles of fungus.
lock,lack,Its cheap and it shows a lock of respect for the reader.
clowning,cloning,"Department of Energy Human Genome Program, supra note 6 Cloning Human clowning is one of the techniques of modern biotechnology."
world,word,"In the Nintendo GameCube game Animal Crossing, and the Nintendo DS follow-up Animal Crossing Wild World, a rabbit character known as Snake uses the world bunyip as his default catchphrase."
toe,tone,Presumably he preferred Arnold Schoenbergs completely non-tonal non-piece specific method of twelve toe music.
axis,axes,"George Perle and Elliott Antokoletz focus on alternative methods of signaling tonal centers, via axis of inversional symmetry."
face,fact,This could also be attributed to the face that most cases of bipolar disorder are first misdiagnosed as depression.
part,party,Another misconception is the idea of women generally being the dominant part in BDSM relationships.
fag,fog,"Falling snowflakes, suspended fag droplets or ice particles in the air would make conditions even worse."
supporter,support,"However, the portrayal of Robert the Bruces wavering is relatively accurate, especially regarding his inconsistent supporter of Scottish independence."
alliance,dalliance,"Their supposed alliance occurs in the film after the Battle of Falkirk, which occurred in 1298, when Isabella was about three years old."
surfs,serfs,"The first written referance to a balalaika was on an arrest slip for two surfs in 1688, accused of being drunk and disorderly outside the Kremlin in Moscow, playing the balalaika."
fir,firm,"It has been suggested that he did marry, and had a son in 1922, but fir evidence is unavailable.The beginning of the recording career Unlike many artists who were discovered and recorded in their normal venues, in December 1925 or January 1926, he was taken to Chicago, Illinois, to record his first tracks."
retarding,regarding,"Stories As his fame grew, so did the tales retarding his life, often personally involving the teller."
let,set,"At the same time in Germany Goethe cooperated with Schiller on a series of ballads, some of which were later let to music by Schubert."
parental,parenteral,Beta-lactamase may be clinically beneficial when orally administered to preserve the natural intestinal flora during the parental administration of anti-biotics.
employ,imply,"Instead why not say, the term is controversial because it can be seen to employ that Ireland is British."
bison,boson,"Sarah777 talk 09 07, 16 September 2008 UTC Maybe theyll find in CERN right next to Higgs bison."
back,black,What makes it impossible to escape from back holes?
hold,hole,But the supernova is a side-effect and does not directly contribute to producing the black hold or other type of compact star.
rest,resist,Gravitational collapse occurs when an objects internal pressure is insufficient to rest the objects own gravity.
staving,starving,"This allowed the attacking force to fight against lightly armed logistics units, staving the enemy of information and supplies."
looses,loses,"If the bee looses its stinger, it can die."
powder,power,Since 2001 there has been some crossover with powder pop and pop punk from bands that play live instruments.
notes,nodes,"When data is inserted or removed from a node, its number of child notes changes."
dept,debt,People who are really insolvent can clean their debts with a process called dept cleaning Swedish skuldsanering.
feet,fleet,"French ports were blockaded by the Royal Navy, which won a decisive victory over the French feet at Trafalgar in 1805."
starring,staring,"It has the demeaning presence of German Expressionism and fascist architecture, starring down at the citizens."
unaccredited,uncredited,Wesley Strick would eventually rewrite the shooting script unaccredited.
stimulate,simulate,The set was covered with foam and polyester fabric stuffing to stimulate snowdrifts.
outside,outsider,"In early scripts Max Shreck was the golden boy of the Cobblepot family, whereas Penguin was the deformed outside."
decease,disease,Alfred is struggling with a rare decease that Mr.
cape,cane,Jim Carrey went through over 50 different spandex outfits and over 100 different props for his cape.
aid,said,"I invite him, or anyone else, to fix it, rather than changing what I aid."
"ie,",time,"In Wiki tie, a day is something on the order of a few days in dog years, its long past time to walk the pooch."
backs,blacks,"About 150,000 backs live in Israel, this amounts to just over 2% of the nations population."
systems,symptoms,This could not be confirmed since the cat was destroyed prior to the onset of systems.
morality,mortality,"Untreated septicemic plague is universally fatal, but early treatment with antibiotics reduces the morality rate to between 4 and 15 percent."
manes,names,"Additionally, Season 3 sees a community of Benedictine monks take up residence on B5 to learn the manes of god through out the universe."
swaps,swamps,"Herodotus records that 6,400 Persians bodies were counted on the battlefield, and it is unknown how many perished in the swaps."
prises,prices,It is possible for the terms of trade to be lower than before if there is an improvement in the balance of trade e.g. if an export increase came about by lowering prises.
plats,plants,"For example, when carbon dioxide levels increase in the atmosphere, plats grow more quickly."
mediates,meditates,"Other inspiration may have come from Davids words in the Psalms Seven times a day I praise you Ps. 119 164, as well as, the just man mediates on the law day and night Ps. 1 2."
repost,riposte,Deborah Skinner now aka Deborah Buzan wrote a vehement repost in the Guardian.
Racial,Radical,Theory Racial behaviorism seeks to understand behavior as a function of environmental histories of reinforcing consequences.
complimented,complemented,"Some black metal songs are complimented with choir-like vocals by males or females, much like a Gregorian chant."
castes,castles,"Other themes that are commonly explored include misanthropy, nihilism, death and cold, dark environments like forests or castes for example."
prescience,presence,"On July 9th, 2008, Blizzard officially merged with Activision to form Activision Blizzard, although Blizzard maintains an independent web prescience and, nominally, independent management."
structures,strictures,"The word Bayesian appeared in the 1950s, but by the 1960s, it became the term preferred by people who sought to escape the structures of the narrower frequentist approach to probability theory."
etymology,etiology,"I do think the first Jamison quote can be replaced by something more balanced, or at the very least, in the interests of NPOV, counterbalanced by an additional view of its nature/etymology etc."
tole,toll,The dynasty was in a position of power for around a decade until the Napoleonic Wars began to take their tole.
warm,warn,"The young Australian males then proceed to warm them about drop bears saying that they re like a koala, only bigger and meaner and they drop from the trees."
snow,show,Air show overview The Blue Angels snow season runs each year from March until November.
cited,sited,"In the early 1960s newer generations of missiles with solid rocket motors were being introduced that could be launched quickly, faster than bombers, and were cited in underground silos for protection."
plain,plane,"Unlike a manned interceptor that maneuvers within a plain while climbing, missiles flew straight up and could reach the B-70s altitude in a few minutes."
effected,affected,"The aircraft was a total loss, however damage was contained and no other aircraft were effected."
climatic,climactic,"In the 2009 film Transformers Revenge of the Fallen, a B-1B is shown dropping numerous 2000 pound JDAMs in the climatic battle scene."
piece,peace,Some examples of well-known phrases from the Book of Common Prayer are Speak now or forever hold your piece from the marriage liturgy.
pays,plays,He still pays this song with his band and often performs on the Isle of Man at the TT races.
diaries,dairies,In 1971 Cavenham Foods acquired the Bovril Company but then sold most of its diaries and South American operations to finance further take-overs.
spared,sparked,"This move spared widespread protests among the Okinawans, including the local government and all of the island s political countries."
added,aided,"If researchers modify its genotype at the egg stage, they can see results on its organs barely three days later added by the transparency of the embryos."
shop,ship,"Eventually, he traveled to New Orleans in the United States as a crewman aboard a merchant shop."
addition,addiction,"She had been a fan of his, writing letters to him when he was in hospital recovering from addition to Demerol."
sees,seas,"Former poet and Catholic Bishop of Down and Connor, Dr William Philbin wrote this of Belfast Belfast is a city walled in by mountains, moated by sees, and undermined by deposits of history."
brought,bought,"Unable to dance, she brought a ticket to Los Angeles."
additions,editions,Many electronic additions of the factbook have been available for sale from third parties since the 1980s.
quality,equality,Sexual quality is a high priority in Denmark.
bite,site,Cytoplasm Filling Fluid from Biology4Kids.com Function The cytoplasm is the bite where most cellular activities are done.
brining,bringing,Please dont make it sound like they ve been there for a while and you are just brining Canadas article in line.
tents,tenets,None of these groups though would be considered to be part of Christianity in general by those who hold the more traditional tents of faith described in the paragraph above.
ear,era,"Muslims, Jews, and Eastern Christians suffered persecution during the ear of the Crusades."
cannon,canon,"After the time of Jesus, Christian Gnostics were very active and maintained several additional books of scripture outside of what was later to become cannon; one example is The Gospel of Thomas."
sited,cited,"They also reject the historicity of the empty tomb sited by many Christians as proof of the resurrection while affirming the historicity of resurrection appearances to Peter, Paul and others."
discreet,discrete,"While discreet component transistor CPUs were in heavy usage, new high performance designs like SIMD Single Instruction Multiple Data vector processors began to appear."
exist,exits,"This separation can be compared to an assembly line, in which an instruction is made more complete at each stage until it exist the execution pipeline and is retired."
costs,coasts,In 1502 Christopher Columbus navigated near the costs of Choco.
Catatonic,Catatonia,Catatonic is a syndrome of psychic and motoric-disturbances.
contacts,contracts,This is the reason for the frequent choice of the law of the State of New York in commercial contacts.
fle poli,recording,Copyright can also be used to stifle political criticism.
statue,statute,"One theory holds that copyrights origin occurs at the creation of a work, the other that its origin exists only through the copyright statue."
runaways,runways,"Czech Republic has 46 airports, out of which two have over 3,047 meter runaways."
manner,matter,"Although the country is economically better positioned than other EU Members to adopt the euro, the change not expected before 2013 due to political reluctance on the manner."
principals,principles,It is a science because given a system of interest it performs /analysis/ and seeks general principals to explain that system.
impassible,impassable,"Roads are mostly unsurfaced and are likely to be impassible during the wet season, especially in the southern half of the country."
eternal,external,Computer games are often more powerful than console games because of early market releases of their eternal architecture and graphics cards.
local,loyal,The most local fan-base is reported to be for large role-playing games such as Oblivion.
king,kind,"It seems wrong to say that went to a ballgame is a property that instantiates John, because went to a ballgame does not seem to be the same ontological king of thing as, for instance, redness."
pockets,packets,Regular concrete Regular concrete can be described as a lay term to describe concrete that is produced by following the mixing instuctions that are commonly published on pockets of cement.
stump,slump,"Workability can be measured by the stump test, a simplistic measure of the plasticity of a fresh batch of concrete following the ASTM C 143 or EN 12350-2 test standards."
polar,solar,"The Gregorian calendar, as a final example, is complete, polar, and mixed."
conference,confluence,"Both islands are found at the conference of the Amur and Ussuri Rivers, and were until then administered by Russia and claimed by China."
capitol,capital,The states capitol is Sacramento.
capital,capita,"Per capital personal income was $48,460 as of 2005, ranking 13th in the nation."
beats,beets,"Important crops include apples, potatoes, alfalfa, wheat, corn, barley, hops, beans, and sugar beats."
foaming,forming,"It stretches from the Canadian province of British Columbia through the U.S. state of Washington, foaming much of the border between Washington and Oregon before emptying into the Pacific Ocean."
owed,owned,"Most agree that capitalism replaced feudalism, a system where in principle the state, in the form of a hereditary ruler, owed all of the means of production."
complement,compliment,"RJII 16 42, 22 Mar 2005 UTC Chill, alleging that you are putting anarcho-capitalism in the article is not an accusation it is a complement."
price,prize,I ve been surprised at how seminal noble price winner von Hayek was in that field.
rations,ratios,"Castas denoting different ratios of European and Amerindian mixtures thus came into disuse, except for mestizo , which survived to denote all rations of this mixture."
